{
  "schema": "haven.scheduled-task-stamp.v1",
  "task": "korrespondanse-sjekk",
  "programSha256": "0000000000000000000000000000000000000000000000000000000000000000",
  "firstRunAt": "2026-10-03T08:00:04Z",
  "runCount": 9,
  "startedAt": "2026-10-03T12:30:05Z",
  "finishedAt": "2026-10-03T12:30:09Z",
  "outcome": "partial",
  "exitCode": 1,
  "profiles": [
    {
      "profile": "kjetil-vegar-d",
      "outcome": "ok",
      "consecutiveFailures": 0,
      "unread": 2,
      "senders": 1
    },
    {
      "profile": "kjetil-d",
      "outcome": "failed",
      "consecutiveFailures": 2,
      "failureClass": "klienten meldte feil",
      "failureDetail": "recipient_not_allowed: credential expired for device-0a1b2c3d-0000-4000-8000-000000000001"
    }
  ],
  "markers": {
    "written": [
      "ulest-kjetil-vegar-d-vegar-local-agent",
      "sjekk-feilet-kjetil-d"
    ],
    "removed": []
  },
  "siblingStale": false
}
